{
  "schema": "blessed/release-receipt/v1",
  "producer_repo": "JonathanPorta/pilot",
  "release_id": 199884413,
  "tag": "v0.4.3",
  "target_sha": "86e5a3f4c1d29b077e5518a3d0c46f9b2a7e1d84",
  "draft": false,
  "prerelease": false,
  "published_at": "2026-08-13T01:24:49Z",
  "manifest_asset": {
    "name": "release-candidate.json",
    "sha256": "df8deef54212df13c036ddbd7ab40dd44df3c9a8c14f3125af2de2469922aca9"
  }
}
